{
  "schema_version": "content-quality-ledger/v1",
  "generated_at": "2026-08-12T00:00:00Z",
  "scope": {
    "description": "Manual visual review decisions for fixed-revision Prompt/output pairs. Source inventory remains immutable; these decisions only constrain review and publication projections.",
    "normalization": "NFC, CRLF/CR to LF, trim trailing whitespace per line, trim document edges",
    "reviewed_exact_prompt_group_count": 29,
    "reviewed_source_case_count": 69,
    "reviewed_output_reference_count": 78
  },
  "decisions": [
    {
      "source_id": "freestylefly-awesome-gpt-image-2",
      "revision_sha": "76fcd0e6b3961ef2b041547aac654f1efd1ef270",
      "source_case_key": "freestylefly-awesome-gpt-image-2:49",
      "prompt_sha256": "041533e82c02330fa5ebad284ac93b5aab327db9bf02920f27a73510d06edad7",
      "output_content_sha256": [
        "456436ac2f6f95e36166b812c5e84eb98d2ff585f065461af69e077e5ca11042"
      ],
      "verdict": "blocked",
      "reason_code": "non_result_capture",
      "review_method": "manual_visual_exact_prompt_group_v1",
      "review_note": "The asset is a ChatGPT conversation screenshot containing a generated image preview, not the prompt's clean output image."
    },
    {
      "source_id": "freestylefly-awesome-gpt-image-2",
      "revision_sha": "76fcd0e6b3961ef2b041547aac654f1efd1ef270",
      "source_case_key": "freestylefly-awesome-gpt-image-2:108",
      "prompt_sha256": "6d758e728562ef41e146c2f7027d23fd1252e6e6ebc085153423ebecbdc8aa4c",
      "output_content_sha256": [
        "01f8b86c17252ac4ed1c493c60c4822878e109f71dc6b7c2b4f1aafcc544012b"
      ],
      "verdict": "blocked",
      "reason_code": "non_result_capture",
      "review_method": "manual_visual_exact_prompt_group_v1",
      "review_note": "The asset is a workflow/chat screenshot with embedded result thumbnails rather than a clean generated livestream result."
    },
    {
      "source_id": "freestylefly-awesome-gpt-image-2",
      "revision_sha": "76fcd0e6b3961ef2b041547aac654f1efd1ef270",
      "source_case_key": "freestylefly-awesome-gpt-image-2:145",
      "prompt_sha256": "854297911370d1351a1ba7bfbd3dc0a5108117758572399c958f9b8cea4620be",
      "output_content_sha256": [
        "2b090f2eb2a95d4bcd99f5d3a1b0609b5cedd889a668aaf37afefe184a3abb15"
      ],
      "verdict": "blocked",
      "reason_code": "prompt_output_mismatch",
      "review_method": "manual_visual_exact_prompt_group_v1",
      "review_note": "The prompt requests a Taobao T-800 product detail page, but the asset is a Trump/Kim Douyin battle livestream."
    },
    {
      "source_id": "freestylefly-awesome-gpt-image-2",
      "revision_sha": "76fcd0e6b3961ef2b041547aac654f1efd1ef270",
      "source_case_key": "freestylefly-awesome-gpt-image-2:146",
      "prompt_sha256": "854297911370d1351a1ba7bfbd3dc0a5108117758572399c958f9b8cea4620be",
      "output_content_sha256": [
        "b59e4fee310125ade43b0a4e76fc4b98bb7479ce54a8c827efdb537daaf9a0ad"
      ],
      "verdict": "blocked",
      "reason_code": "prompt_output_mismatch",
      "review_method": "manual_visual_exact_prompt_group_v1",
      "review_note": "The prompt requests a Taobao T-800 product detail page, but the asset is a social-profile page for a female creator."
    },
    {
      "source_id": "freestylefly-awesome-gpt-image-2",
      "revision_sha": "76fcd0e6b3961ef2b041547aac654f1efd1ef270",
      "source_case_key": "freestylefly-awesome-gpt-image-2:147",
      "prompt_sha256": "854297911370d1351a1ba7bfbd3dc0a5108117758572399c958f9b8cea4620be",
      "output_content_sha256": [
        "e3542611ae1e6bacf25ee2a9a22bae2fe1fd07300b76a4da512c34f8b500b018"
      ],
      "verdict": "blocked",
      "reason_code": "prompt_output_mismatch",
      "review_method": "manual_visual_exact_prompt_group_v1",
      "review_note": "The prompt requests a Taobao T-800 product detail page, but the asset is a classroom blackboard photograph."
    },
    {
      "source_id": "freestylefly-awesome-gpt-image-2",
      "revision_sha": "76fcd0e6b3961ef2b041547aac654f1efd1ef270",
      "source_case_key": "freestylefly-awesome-gpt-image-2:272",
      "prompt_sha256": "55234219fe8b79736688b309fb002a9cae3d702460a6b6126370e3d852107600",
      "output_content_sha256": [
        "61e640ee3ecd7f57c01fd571f25847be3ed74f6193c97c8f7581b9e5f436b3e0"
      ],
      "verdict": "duplicate_only",
      "reason_code": "near_identical_cross_source_render",
      "review_method": "manual_visual_exact_prompt_group_v1",
      "review_note": "The same prompt and near-identical render are already represented by erickkkyt-awesome-gptimage2-prompts:x-2045092449803284923; normalized-frame SSIM is 0.995108."
    },
    {
      "source_id": "freestylefly-awesome-gpt-image-2",
      "revision_sha": "76fcd0e6b3961ef2b041547aac654f1efd1ef270",
      "source_case_key": "freestylefly-awesome-gpt-image-2:433",
      "prompt_sha256": "19dc3c592d16bb3c4b3c78068288d841351a7c892d85a1d7a63f8179930d9da4",
      "output_content_sha256": ["2f1f1c8872aa6d1cfcfe468713491b827f9558f4af22e66bcb6344c02796770d"],
      "verdict": "duplicate_only",
      "reason_code": "exact_prompt_output_subset",
      "review_method": "manual_visual_exact_prompt_group_v1",
      "review_note": "Exact Prompt/output subset of the richer Erick record x-2055492435862773978; provenance remains preserved but this member must not create a second public case."
    },
    {
      "source_id": "freestylefly-awesome-gpt-image-2",
      "revision_sha": "76fcd0e6b3961ef2b041547aac654f1efd1ef270",
      "source_case_key": "freestylefly-awesome-gpt-image-2:421",
      "prompt_sha256": "3173bb08fffa063c78eb15b04484d55751a5f187b0f80f05764ebcdcdb6394d0",
      "output_content_sha256": ["a0e47b696f4566b6a9c7c4ad204876e630b469a3b077ad2c938e864f55c07af8"],
      "verdict": "duplicate_only",
      "reason_code": "exact_prompt_output_subset",
      "review_method": "manual_visual_exact_prompt_group_v1",
      "review_note": "Exact Prompt/output subset of the richer Erick record x-2053535379618423118; provenance remains preserved but this member must not create a second public case."
    },
    {
      "source_id": "freestylefly-awesome-gpt-image-2",
      "revision_sha": "76fcd0e6b3961ef2b041547aac654f1efd1ef270",
      "source_case_key": "freestylefly-awesome-gpt-image-2:19",
      "prompt_sha256": "967d370c120d9c00fca6f63a92b1321b6288c4131a086253829b301ab9a94d25",
      "output_content_sha256": ["ae055aecfc7cc0b25ccf5d0d1ac06dacfd98b67f560c079edc2cedcd103a0de5"],
      "verdict": "duplicate_only",
      "reason_code": "exact_prompt_output_subset",
      "review_method": "manual_visual_exact_prompt_group_v1",
      "review_note": "Exact Prompt/output subset of the richer Erick Momotaro explainer record; provenance remains preserved but this member must not create a second public case."
    },
    {
      "source_id": "freestylefly-awesome-gpt-image-2",
      "revision_sha": "76fcd0e6b3961ef2b041547aac654f1efd1ef270",
      "source_case_key": "freestylefly-awesome-gpt-image-2:20",
      "prompt_sha256": "967d370c120d9c00fca6f63a92b1321b6288c4131a086253829b301ab9a94d25",
      "output_content_sha256": ["d1e1422e33801ca5bf7d0f6601ff90d3b149b4884e82998eeed50180e5e868c3"],
      "verdict": "duplicate_only",
      "reason_code": "exact_prompt_output_subset",
      "review_method": "manual_visual_exact_prompt_group_v1",
      "review_note": "Exact Prompt/output subset of the richer Erick Momotaro explainer record; provenance remains preserved but this member must not create a second public case."
    },
    {
      "source_id": "freestylefly-awesome-gpt-image-2",
      "revision_sha": "76fcd0e6b3961ef2b041547aac654f1efd1ef270",
      "source_case_key": "freestylefly-awesome-gpt-image-2:21",
      "prompt_sha256": "363d73743173c96c7b90233f66c33db70d50036eb76c282df4440f6caf1a9bc6",
      "output_content_sha256": ["748f3854ab3e5d319e9f85df4a7834b63811b143c6badc60db58b2ebfcb52873"],
      "verdict": "duplicate_only",
      "reason_code": "exact_prompt_output_subset",
      "review_method": "manual_visual_exact_prompt_group_v1",
      "review_note": "Exact Prompt/output duplicate of the Erick e-commerce livestream record; provenance remains preserved but this member must not create a second public case."
    },
    {
      "source_id": "freestylefly-awesome-gpt-image-2",
      "revision_sha": "76fcd0e6b3961ef2b041547aac654f1efd1ef270",
      "source_case_key": "freestylefly-awesome-gpt-image-2:23",
      "prompt_sha256": "36ef962401201ffc4379428239105e5578a573d71c420064cac3d1b4ab649845",
      "output_content_sha256": ["b5d39f7c4ecb3f14e5dc65bbf19299a85e62b3a62ffc408a1691b5e238263e05"],
      "verdict": "duplicate_only",
      "reason_code": "exact_prompt_output_subset",
      "review_method": "manual_visual_exact_prompt_group_v1",
      "review_note": "Exact Prompt/output duplicate of the richer Erick evolution infographic record; provenance remains preserved but this member must not create a second public case."
    },
    {
      "source_id": "freestylefly-awesome-gpt-image-2",
      "revision_sha": "76fcd0e6b3961ef2b041547aac654f1efd1ef270",
      "source_case_key": "freestylefly-awesome-gpt-image-2:17",
      "prompt_sha256": "5920dad88a72defe38e676f8f6a75a0cd0c1846c92ab0822a7cebd374a43f84f",
      "output_content_sha256": ["97e848f6ad45cdd5b2c9f62c43725953afdcd52f3f2c261ec5869de92a730e85"],
      "verdict": "duplicate_only",
      "reason_code": "exact_prompt_output_subset",
      "review_method": "manual_visual_exact_prompt_group_v1",
      "review_note": "Exact Prompt/output duplicate of the richer Erick VR exploded-view record; provenance remains preserved but this member must not create a second public case."
    },
    {
      "source_id": "freestylefly-awesome-gpt-image-2",
      "revision_sha": "76fcd0e6b3961ef2b041547aac654f1efd1ef270",
      "source_case_key": "freestylefly-awesome-gpt-image-2:131",